{
  "schema_version": "1.0",
  "brand_id": "calapres",
  "accepted": true,
  "decision": "owner_decision_preview",
  "reason_code": "owner_decision_validated_no_write",
  "owner_decision": {
    "schema_version": "1.0",
    "brand_id": "calapres",
    "decision_id": "dec_synthetic0001",
    "incident_id": "inc_synthetic0001",
    "action": "reply_only",
    "approver_ref": "own_primary001",
    "case_reply_ref": "dft_synthetic001",
    "case_reply_sha256": "eeeeeeeeeeeeeeeeeeeeeeeeeeeeeeeeeeeeeeeeeeeeeeeeeeeeeeeeeeeeeeee",
    "knowledge_proposal_ref": null,
    "knowledge_proposal_sha256": null,
    "base_knowledge_version": null,
    "knowledge_version_to_publish": null,
    "supersedes_knowledge_version": null,
    "decided_at": "2026-08-11T09:08:00.000Z",
    "effective_at": "2026-08-11T09:08:00.000Z",
    "expires_at": null
  },
  "incident_reference": {
    "incident_id": "inc_synthetic0001",
    "incident_revision": 1,
    "conversation_ref": "cwr_synthetic001",
    "status_before": "awaiting_owner"
  },
  "persistence_preview": {
    "mode": "preview_no_write",
    "persistence_ready": false,
    "required_additive_columns": {
      "approvals": [],
      "incidents": [],
      "audit": []
    },
    "future_write_preconditions": [
      "fresh_chatwoot_incident_reread",
      "owner_actor_allowlist_match",
      "cryptographic_nonce_attestation",
      "command_digest_recomputed_from_canonical_payload",
      "case_reply_digest_reverification",
      "knowledge_proposal_digest_reverification",
      "incident_revision_compare_and_swap",
      "atomic_idempotency_guarantee",
      "live_table_schema_reverification"
    ],
    "approvals": {
      "table_id": "mjSEDJWfXqCL0sG0",
      "required_operation": "upsert_after_all_write_preconditions",
      "key_column": "approval_id",
      "table_row": {
        "schema_version": "1.0",
        "brand_id": "calapres",
        "account_id": 179973,
        "inbox_id": 128058,
        "channel": "whatsapp",
        "approval_id": "dec_synthetic0001",
        "incident_id": "inc_synthetic0001",
        "incident_revision": 1,
        "conversation_id": "cwr_synthetic001",
        "approval_scope": "case_only",
        "action": "reply_only",
        "status": "prepared",
        "approver_ref": "own_primary001",
        "case_reply_ref": "dft_synthetic001",
        "case_reply_sha256": "eeeeeeeeeeeeeeeeeeeeeeeeeeeeeeeeeeeeeeeeeeeeeeeeeeeeeeeeeeeeeeee",
        "knowledge_proposal_ref": null,
        "knowledge_proposal_sha256": null,
        "base_knowledge_version": null,
        "knowledge_version_to_publish": null,
        "supersedes_knowledge_version": null,
        "effective_at": "2026-08-11T09:08:00.000Z",
        "expires_at": null,
        "decided_at": "2026-08-11T09:08:00.000Z",
        "audit_ref": "aud_aaaaaaaaaaaaaaaaaaaaaaaa",
        "committed_at": null,
        "command_digest": "bbbbbbbbbbbbbbbbbbbbbbbbbbbbbbbbbbbbbbbbbbbbbbbbbbbbbbbbbbbbbbbb",
        "auth_evidence_kind": "owner_review_topology_v1",
        "auth_evidence_fingerprint": "cccccccccccccccccccccccccccccccccccccccccccccccccccccccccccccccc",
        "nonce_fingerprint": "dddddddddddddddddddddddddddddddddddddddddddddddddddddddddddddddd",
        "nonce_issued_at": "2026-08-11T09:07:50.000Z",
        "nonce_expires_at": "2026-08-11T09:13:00.000Z",
        "review_idempotency_fingerprint": "aaaaaaaaaaaaaaaaaaaaaaaaaaaaaaaaaaaaaaaaaaaaaaaaaaaaaaaaaaaaaaaa",
        "source_private_message_fingerprint": "ffffffffffffffffffffffffffffffffffffffffffffffffffffffffffffffff",
        "fingerprint_key_version": "hmac-sha256-v1"
      },
      "write_executed": false
    },
    "incidents": {
      "table_id": "N3UJZWRMNehLX4l7",
      "required_operation": "update_after_all_write_preconditions",
      "key_column": "incident_id",
      "table_row": {
        "schema_version": "1.0",
        "brand_id": "calapres",
        "incident_revision": 1,
        "correlation_id": "calapres:synthetic:004",
        "reason_code": "owner_authority_required",
        "draft_ref": "dft_synthetic001",
        "conversation_id": "cwr_synthetic001",
        "created_at": "2026-08-11T09:07:00.000Z",
        "incident_id": "inc_synthetic0001",
        "incident_type": "return_or_refund",
        "order_ref": null,
        "owner_decision": "dec_synthetic0001",
        "proposed_action": "reply_only",
        "resolved_at": null,
        "severity": "medium",
        "status": "awaiting_owner",
        "summary_sanitized": "Incident inc_synthetic0001 remains awaiting owner; category=return_or_refund; reason=owner_authority_required; decision=reply_only recorded as preview only.",
        "updated_at": "2026-08-11T09:08:00.000Z"
      },
      "write_executed": false
    },
    "audit": {
      "table_id": "4YBUAuuEgXYiaybJ",
      "required_operation": "insert_after_all_write_preconditions",
      "key_column": "audit_id",
      "table_row": {
        "schema_version": "1.0",
        "brand_id": "calapres",
        "idempotency_key": "aaaaaaaaaaaaaaaaaaaaaaaaaaaaaaaaaaaaaaaaaaaaaaaaaaaaaaaaaaaaaaaa",
        "outcome": "validated_no_write",
        "actor_type": "owner",
        "conversation_ref": "cwr_synthetic001",
        "incident_id": "inc_synthetic0001",
        "knowledge_version": null,
        "workflow_release": "calapres-owner-review-desk-v1",
        "audit_id": "aud_aaaaaaaaaaaaaaaaaaaaaaaa",
        "correlation_id": "calapres:synthetic:004",
        "created_at": "2026-08-11T09:08:01.000Z",
        "decision": "owner_decision_preview",
        "details_sanitized": "Validated owner action reply_only for incident inc_synthetic0001; preview only and no persistence executed.",
        "event_type": "owner_decision_recorded",
        "reason_code": "owner_decision_validated_no_write",
        "source_ref": "dec_synthetic0001"
      },
      "write_executed": false
    },
    "write_executed": false
  },
  "knowledge_publish_executed": false,
  "customer_egress_allowed": false,
  "data_table_write_allowed": false
}
